coffee_id,roaster,roast,origin,100g_USD,review
1008,Coffee Please,Medium-Light,Ethiopia,5.24,"Confidently sweet-tart, decidedly floral. Honeysuckle, tangerine zest, plum, pipe tobacco, maple syrup in aroma and cup. Sweet-toned with bright, juicy acidity; silky-smooth mouthfeel. Crisp, flavor-saturated finish."
404,Old World Coffee Lab,Medium-Light,Ethiopia,5.58,"Delicately vibrant, crisply sweet-tart. Peach, cocoa nib, lilac, pink grapefruit zest, pistachio in aroma and cup. Balanced, sweetly tart in structure; richly silky mouthfeel. The satisfying finish consolidates to notes of cocoa-toned stone fruit."
605,Dragonfly Coffee Roasters,Medium-Light,Costa Rica,19.84,"Rich, high-toned, sweetly herbaceous. Lemon verbena, roasted almond, black cherry, narcissus, black peppercorn in aroma and cup. Savory-sweet structure with high-toned, lively acidity; plush, syrupy mouthfeel. The finish leads with black cherry and narcissus in the short, with notes of almond and peppercorn in the long, and an undercurrent of lemon verbena throughout."
246,Nostalgia Coffee Roasters,Medium-Light,Ethiopia,6.47,"Juicy, fruit-toned, bright and lively. Raspberry jam, dark chocolate, hop flowers, thyme, wild honey in aroma and cup. Richly bittersweet in structure, balanced with juicy acidity; very smooth, syrupy mouthfeel. The finish centers around notes of raspberry and dark chocolate supported by richly bittersweet hop flowers."
1219,Kakalove Cafe,Medium-Light,Ethiopia,3.89,"Delicate, high-toned, richly floral. Lilac, cocoa nib, dried apricot, sandalwood, a hint of coconut in aroma and cup. Sweet-tart structure with juicy acidity; plush, syrupy mouthfeel. Rich, deeply aromatic finish that carries over all the notes from the cup; lilac and cocoa nib, in particular."
333,Taster’s Coffee,Light,Ethiopia,21.38,"Delicate, richly sweet, floral-toned. Star jasmine, raspberry, cocoa nib, maple syrup, sandalwood in aroma and cup. Bright, sweet-tart structure with juicy acidity; plush, satiny mouthfeel. The long finish centers around deep floral and bright berry tones, grounded by cocoa nib."
527,Cafe Red Bean Shop,Light,Ethiopia,7.05,"High-toned, floral-driven. Star jasmine, bergamot, red plum, cocoa nib, sandalwood in aroma and cup. Sweetly tart with vibrant, juicy acidity; delicate, silky-smooth mouthfeel. In the finish, star jasmine and cocoa nib give way to bergamot and sandalwood."
1164,Kakalove Cafe,Medium-Light,Indonesia,3.19,"Sweetly earth-toned, deeply floral. Petrichor, honeysuckle, Dark chocolate, petrichor, honeysuckle, nectarine, fine pipe tobacco in aroma and cup. Sweet-savory structure with vibrant, juicy acidity; full, syrupy mouthfeel. Deep, resonant finish consolidates to notes of petrichor and honeysuckle with dark chocolate undertones."
45,Speckled Ax,Medium-Light,El Salvador,7.35,"Fruit-forward, crisply sweet. Peach, grapefruit zest, hazelnut, molasses, oak in aroma and cup. Savory-sweet structure with round, gentle acidity; full, satiny mouthfeel. The resonant finish centers around notes of peach, grapefruit zest and oak."
1132,Paradise Roasters,Light,Colombia,14.11,"Delicately aromatic, complex, citrusy. Bergamot, candied violet, cocoa nib, honeysuckle, pineapple taffy in aroma and cup. Richly bittersweet structure with bright acidity; plush, syrupy mouthfeel. Resonant, long, flavor-laden finish that carries through on the promise of the cup."
372,Paradise Roasters,Light,Colombia,8.79,"Elegantly floral, delicately fruit-toned. Honeysuckle, pink grapefruit zest, agave syrup, cocoa nib, lemon balm in aroma and cup. Richly sweet structure with bright, balanced acidity; lyrically silky mouthfeel. Pretty floral-leaning finish centers on notes of honeysuckle and lemon balm with undertones of cocoa nib."
670,Kona Love Coffee Co.,Medium,Hawai'I,7.72,"Bold, chocolaty, rich-toned. Dark chocolate, nougat, gardenia, date, gently scorched cedar in aroma and cup. Sweet-savory structure with gentle, round acidity; creamy-smooth mouthfeel. Sweetly wood-framed, chocolaty finish."
363,Kakalove Cafe,Medium-Light,Panama,7.08,"Evaluated as espresso. Richly floral, complex, nuanced. Lilac, dark chocolate, black cherry, myrrh, lemon-thyme in aroma and small cup. Very syrupy-smooth mouthfeel; deep, rich, flavor-laden finish. This coffee particularly impresses in three parts milk, with lyric, lilac top notes, rich, fudge-like bottom notes, and black cherry, myrrh and lemon thyme in the mid-palate."
81,GK Coffee,Medium-Light,Costa Rica,9.6,"Deeply sweet-savory, unusual. Caramel, goat milk yogurt, raspberry, cedar, sage in aroma and cup. Richly bittersweet in structure with bright acidity; syrupy mouthfeel. Savory-leaning finish with undertones of caramel and sage."
345,Temple Coffee and Tea,Medium-Light,Ethiopia,5.14,"Delicate, intricate, richly sweet. Dried jasmine, mango chutney, myrrh, baker’s chocolate, bergamot in aroma and cup. Sweetly tart structure with lively acidity; delicate, satiny mouthfeel. Tart-leaning, rich-toned finish, characterized by notes of mango chutney and baker’s chocolate."
476,PT's Coffee Roasting Co.,Medium-Light,Panama,28.66,"High-toned, crisply sweet-tart. Pink grapefruit zest, cocoa nib, tamarind, amber, grape candy in aroma and cup. Sweet-tart structure with tart-leaning, lively acidity; syrupy-smooth mouthfeel. The flavor-saturated finish resonates with all of the notes from the cup. "
218,Kakalove Cafe,Medium-Light,Ethiopia,4.6,"Delicate, richly floral-toned. Lavender, blood orange, cocoa nib, almond butter, sandalwood in aroma and cup. Balanced structure with fine, floral-toned acidity; silky-smooth, vibrant mouthfeel. The long, sweet finish centers around notes of cocoa nib, lavender and blood orange."
1212,Rusty’s Hawaiian,Medium-Light,Hawai'I,22.05,"Richly aromatic, complex, multi-layered. Lychee, lavender, cocoa nib, hazelnut butter, lemon-thyme in aroma and cup. Sweet-savory with lively, juicy acidity; plush, very syrupy mouthfeel. Long, resonant, flavor-saturated finish."
891,True Coffee Roasters,Medium-Light,Brazil,3.63,"Richly sweet, deeply nut-toned. Almond butter, cane sugar, orange zest, date, a hint of magnolia in aroma and cup. Sweet structure with gentle, round acidity; crisp, satiny mouthfeel. The quiet, sweet finish that leads with notes of almond butter and date."
995,Bird Rock Coffee Roasters,Medium-Light,Colombia,8.52,"Bright, juicy, high-toned. Guava, almond butter, wild honey, tangerine zest, narcissus-like flowers in aroma and cup. Richly sweet, elegantly tart structure with high-toned, vibrant acidity; very full, syrupy mouthfeel. The long, lingering, flavor-saturated finish carries forward all the notes from the cup."
271,Cozy House Coffee,Medium-Light,Ethiopia,4.93,"Deeply sweet, fruit-toned, lively. Black cherry, dark chocolate, marshmallow, macadamia nut, pink grapefruit zest in aroma and cup. Sweet structure with bright, juicy acidity; full, creamy-smooth mouthfeel. The cleanly fruit-toned finish is supported by notes of macadamia nut and dark chocolate."
192,Nostalgia Coffee Roasters,Medium,Mexico,5.29,"Deep, rich, chocolaty. Chocolate fudge, roasted almond, Fig Newton, cedar, gardenia in aroma and cup. Sweet-toned with gentle, round acidity; plush, creamy mouthfeel. Nutty, chocolaty finish."
563,JYL Cafe,Medium-Light,Colombia,8.32,"Resonantly floral, fruit-driven. Narcissus, pomegranate, amber, dark chocolate in aroma and cup. Sweetly tart structure with gently bright, fruity acidity; lively, viscous mouthfeel. The rich, concentrated finish centers around notes of pomegranate and dark chocolate with lush undertones of amber. "
496,Kakalove Cafe,Medium-Light,Kenya,2.97,"Evaluated as espresso. Richly aromatic, deeply sweet-savory, floral-toned. Hop flowers, lilac, butterscotch, almond brittle, date in aroma and small cup. Syrupy-smooth mouthfeel; resonant, lasting finish redolent of both sweet and savory florals and deep nut-butter tones."
1063,Three Keys Coffee,Medium-Light,Democratic Republic Of The Congo,5.88,"High-toned, resinously nutty, intensely sweet. Wild honey, plum, magnolia, mesquite, pistachio in aroma and cup. Sweet-tart structure with savory-leaning acidity; viscous, nectar-like mouthfeel. Gentle, sweetly rich finish with notes of wild honey, pistachio and mesquite into the long."
155,Coffee Please,Medium-Light,Ethiopia,3.55,"High-toned, delicate, richly sweet. Apricot, cocoa nib, plum blossom, cedar, honey in aroma and cup. Sweet-toned structure with bright, juicy acidity; full, syrupy-smooth mouthfeel. Cocoa-toned apricot and plum blossom lead the resonant, lingering finish."
1061,EK Roast Studio,Medium-Light,Yemen,9.59,"Very sweet, richly savory. Honey, tiger lily, fresh pipe tobacco, ginseng, date in aroma and cup. Richly sweet structure with juicy-tart acidity; Syrupy-smooth mouthfeel. Finish leads with notes of pipe tobacco and flowers."
66,JBC Coffee Roasters,Light,Guatemala,5.0,"Richly sweet-savory, citrus-toned. Tangerine zest, maple syrup, pistachio, rhododendron, baking chocolate in aroma and cup. Balanced structure with gentle, round acidity; full, lightly syrupy mouthfeel. The quiet finish is carried by notes of baking chocolate and pistachio."
1224,Big Shoulders Coffee,Medium,Ethiopia,5.29,"Deeply and roundly roast-toned. Dark chocolate, singed cedar, raisin, almond, magnolia in aroma and cup. Sweetly savory with gentle, round acidity; crisp, velvety mouthfeel. Chocolate and raisin lead the way in the quiet finish. "
277,Barrington Coffee Roasting,Light,Indonesia,4.98,"Sweetly pungent, earthy. Moist, fresh-fallen leaves, orange zest, fresh-cut pine, cocoa, lily in aroma and cup. Richly tart in structure, with a savory edge. Light but buoyant mouthfeel. The finish consolidates around cocoa, orange and a deep, lily-like floral note. "
181,Paradise Roasters,Medium-Light,Hawai'I,26.41,"Deeply and richly sweet, resonantly aromatic. Dried mango, wild honey, lilac, pistachio, tangerine zest in aroma and cup. Juicy-sweet structure with refined acidity; lush, syrupy mouthfeel. The finish centers around notes of mango, honey and pistachio."
943,Nook Bakery & Coffee Bar,Medium-Light,Brazil,5.64,"Richly sweet, spice-toned. Ripe banana, roasted cacao nib, elm, freesia-like flowers, roasted cashew in aroma and cup. Roundly sweet-tart structure; lightly velvety mouthfeel. The crisp, richly drying finish consolidates around notes of cashew, cacao nib and a hint of spicy florals."
565,Folklore Coffee,Medium-Light,Costa Rica,7.35,"Richly spice-toned, fruit-driven. Dried papaya, salted caramel, cinnamon, nutmeg, agave syrup in aroma and cup. Sweet, low-toned structure with round acidity; syrupy-smooth mouthfeel. The quiet finish centers around notes of papaya, caramel and nutmeg."
328,Temple Coffee Roasters,Medium-Light,Ethiopia,5.58,"Delicately sweet, subtly tart, elegant. Apricot, almond, cocoa nib, key lime, caramel in aroma and cup. Sweet-tart structure with bright, juicy acidity; very full, syrup mouthfeel. Resonant, cocoa-toned finish."
0,JBC Coffee Roasters,Medium-Light,Indonesia,7.05,"Sweetly herbaceous, deeply aromatic, rich-toned. Dark chocolate, tangerine, fresh-cut thyme, dried plum, magnolia in aroma and cup. Sweet-savory structure with balanced, gently vibrant acidity; very smooth, syrupy mouthfeel. Especially long, flavor-saturated finish that carries over all the aroma and flavor notes from the cup."
447,El Gran Cafe,Medium,Guatemala,1.47,"Chocolate-toned, richly sweet-savory. Dark chocolate, nasturtium, black ucherry, cedar, agave syrup in aroma and cup. Bittersweet structure with gentle, rounded acidity; plush, syrupy mouthfeel. The quiet finish consolidates to crisp cocoa-toned cedar notes."
431,Home in Harmony,Medium-Light,Costa Rica,5.64,"Richly sweet, delicately fermenty. Dried nectarine, dark chocolate, Cointreau, pink peppercorn, lilac in aroma and cup. Sweetly tart structure with winy acidity. Plush, syrupy mouthfeel. Quietly fermenty finish with notes of dark chocolate and Cointreau."
1085,Bird Rock Coffee Roasters,Medium-Light,Ethiopia,5.88,"Complex, intricate, deeply sweet. Star jasmine, cocoa nib, nectarine, frankincense, spearmint in aroma and cup. Bright, juicy acidity; plush, velvety mouthfeel. Resonant, flavor-saturated finish leads with notes of star jasmine and nectarine, balanced by suggestions of crisp cocoa."
1039,Roadmap CoffeeWorks,Medium-Light,Ethiopia,5.73,"Crisply sweet, fruit-forward. Blueberry, baking chocolate, fresh-cut fir, cashew, magnolia in aroma and cup. Sweet-toned with gentle acidity; delicate, satiny mouthfeel. The quiet finish centers around notes of blueberry and fir."
412,Hala Tree Kona Coffee,Medium,Hawai'I,14.55,"Deeply sweet, pleasantly herb-toned. Baking chocolate, spearmint, maple syrup, freesia, hazelnut in aroma and cup. Richly bittersweet structure with brisk acidity; crisp, lightly syrupy mouthfeel. The resonant, nut-toned finish centers around notes of baking chocolate and hazelnut."
1152,Kona Love Coffee Co.,Medium-Light,Hawai'I,9.92,"Crisply sweet-toned. Cocoa nib, hazelnut, dried apricot, magnolia, cedar in aroma and cup. Deeply sweet structure with balanced acidity; full, syrupy mouthfeel. Cocoa-driven finish supported by cedar and hazelnut."
136,Bird Rock Coffee Roasters,Light,Colombia,8.11,"Richly chocolaty, sweetly fermenty. Cherry cordial, chocolate fudge, almond brittle, fine musk, gardenia in aroma and cup. Brightly sweet structure with juicy, winey acidity; full, viscous mouthfeel. Crisply chocolaty, fruity finish with a whisper of alcohol ferment."
128,Red Rooster Coffee Roaster,Light,Ethiopia,5.58,"Elegant, intricately rich. Lemon verbena, raw honey, mango, star jasmine, roasted cacao nib in aroma and cup. Vibrantly sweet-tart in structure with juicy acidity; syrupy mouthfeel. The crisp, cocoa-toned finish consolidates to notes of lemon verbena and jasmine. "
1023,Paradise Roasters,Medium-Light,Ecuador,123.46,"Richly floral-toned, elegant, complex. Star jasmine, tangerine zest, violet candy, cocoa nib, apricot in aroma and cup. Very bright, juicy, delicately sweet-tart structure with high-toned acidity; lush, silky mouthfeel. The long, resonant, lingering finish carries over all the notes from the cup."
472,Coffee Please,Medium-Light,Ethiopia,7.89,"Delicately bright, balanced, crisply sweet. Bing cherry, cocoa nib, lemon yogurt, lavender, fresh-cut oak in aroma and cup. Sweetly tangy with gently lactic, savory-edged acidity; silky, buoyant mouthfeel. A fruit-driven finish is supported by cocoa nib with a continued gentle lactic tang."
411,A.R.C.,Medium-Light,Ethiopia,6.87,"Delicate, gently tart, spice-toned. Pomegranate, cocoa powder, lemon blossom, white peppercorn, hazelnut in aroma and cup. Lively, quietly complex structure; crisp, buoyant mouthfeel. The finish leads with gently drying notes of hazelnut and white peppercorn in the short and segues to cocoa-toned citrus blossoms in the long. "
122,Paradise Roasters,Medium-Light,Hawai'I,22.0,"Sweetly fermenty, deeply rich. Aged red wine, ginger blossom, vanilla, pink grapefruit zest, baking chocolate in aroma and cup. Very sweet, high-toned structure with winy acidity; smooth, creamy mouthfeel. Spice-toned, delicate finish. "
807,Sunny's Coffee,Light,Ethiopia,9.22,"Delicate, crisply sweet. Prairie flowers, fresh-cut fir, almond, orange zest, date in aroma and cup. Sweet-tart structure with brisk acidity; lightly satiny mouthfeel. Wood-framed finish with undertones of orange zest and almond."
1240,Hula Daddy Kona Coffee,Medium-Light,Hawai'I,19.82,"Delicately fruit-toned, richly cocoa-driven. Ripe strawberry, dark chocolate,  almond, freesia-like flowers, a hint of wine barrel in aroma and cup. Sweet-tart structure with crisp, high-toned acidity; full, syrupy mouthfeel. The flavor-saturated finish sustains all of the aroma and flavor notes promised by the cup."
137,Hala Tree Kona Coffee,Medium-Light,Hawai'I,16.53,"Complex, richly tart, with compelling savory undertones. Dark chocolate, pomegranate yogurt, almond brittle, sandalwood, freesia-like flowers in aroma and cup. Balanced structure with juicy, citrusy acidity; very full, syrupy mouthfeel. The flavor-laden finish carries over all the notes from the cup, dark chocolate and pomegranate in particular."
753,Bird Rock Coffee Roasters,Medium-Light,El Salvador,6.17," Deeply sweet-savory, complex, layered. Asian pear, rhododendron, pomelo, Nutella, candied walnut in aroma and cup. Richly bittersweet structure with gently bright acidity; plush, syrupy-smooth mouthfeel. Resonant, long, flavor-laden finish."
191,Islamorada Coffee Roasters,Medium-Light,Uganda,5.88,"Deeply rich and sweet. Molasses, dark chocolate, almond, lily, date in aroma and cup. Sweet-toned structure with gentle, round acidity; velvety mouthfeel. Crisp, quiet finish centers around notes of dark chocolate and almond."
641,Corvus Coffee Roasters,Medium-Light,Brazil,4.56,"Delicate, sweetly bright and gently lemony. Ripe lemon zest, fresh-cut cedar, carnation, roasted cashew, cocoa in aroma and cup. Roundly and lightly sweet-tart in structure; satiny in mouthfeel. Quietly resonant in the finish: flowers and cedar. "
1042,Dragonfly Coffee Roasters,Medium-Light,Panama,30.86,"Delicate, vibrant, richly tart. Passionfruit, roasted cacao nib, sandalwood, star jasmine, bergamot zest in aroma and cup. Sweet-tart in structure with juicy, bright acidity; buoyant, silky mouthfeel. The long, flavor-saturated finish is redolent with notes of passionfruit, star jasmine and cacoa nib."
297,Kakalove Cafe,Medium-Light,Kenya,5.1,"Richly savory-sweet, balanced, layered and lively. Red currant, maple syrup, honeysuckle, sandalwood, dark chocolate in aroma and cup. Deeply sweet-savory structure with juicy, confident acidity; full, syrupy mouthfeel. Long, flavor-saturated finish centers around red fruit and sweet-spicy floral notes."
13,Jaunt Coffee Roasters,Medium-Light,Ethiopia,7.35,"Delicately sweet-tart. Cocoa nib, green plum, hazelnut, lavender, fresh-cut fir in aroma and cup. Crisply sweet structure with bright, citrusy acidity; velvety"
284,Roadmap CoffeeWorks,Medium-Light,Costa Rica,6.76,"Sweetly tart, juicy and vibrant. Pink grapefruit, nectarine, cocoa nib, lavender, cedar in aroma and cup. High-toned structure with sweet, lively acidity; full, syrupy mouthfeel. The resonant finish consolidates to notes of cocoa-toned fruit supported by cedar."
27,JBC Coffee Roasters,Medium-Light,Ethiopia,5.51,"Evaluated as espresso. Layered, complex. Dark chocolate, mango, grapefruit zest, cedar, lily-like flowers in aroma and small cup. Lightly syrupy, lively mouthfeel. Mango, chocolate and a hint of flowers persist in a deeply resonant finish. Crisply lively in three-parts milk: continued chocolate and mango-like fruit, while the floral suggestions hint at butterscotch. "
1032,Drink Coffee Do Stuff,Medium-Light,Kenya,6.17,"Bright, sweetly savory, deep-toned. Black currant, dark chocolate, cedar, hop flowers, jasmine in aroma and cup. Richly bittersweet structure with floral-toned acidity; plush, syrupy mouthfeel. The resonant finish centers around notes of black currant, dark chocolate and hop flowers."
65,Temple Coffee Roasters,Medium,Kenya,6.47,"Evaluated as espresso. Floral-toned, sweetly roast-deep. Frangipane, chocolate fudge, black currant, jasmine, gently scorched cedar in aroma and small cup. Velvety-smooth mouthfeel; the rich, resonant finish centers around notes of black currant and jasmine with with hints of salted fudge. In three parts milk, chocolate and floral tones bloom richly, and black currant deepens."
1227,Simon Hsieh’s Aroma Roast Coffees,Medium,Kenya,12.74,"Evaluated as espresso. Richly chocolaty and floral-toned. Chocolate fudge, narcissus, molasses, sandalwood, dried red currant in aroma and small cup. Creamy-smooth mouthfeel; resonant, flavor-saturated finish. Lyrically sweet in three parts milk, with deep-toned notes of chocolate fudge and narcissus into the long."
853,Espresso Republic,Medium-Light,Colombia,4.41,"Crisply sweet, balanced. Baker’s chocolate, maple syrup, gardenia, cherry, cedar in aroma and cup. Sweet-tart in structure with brisk acidity; velvety mouthfeel. The finish consolidates to baker’s chocolate and gardenia with hints of cedar."
823,Paradise Roasters,Medium-Light,Hawai'I,26.46,"Fresh, integrated, deep-toned. Caramelized mango, ginger blossom, cashew butter, lemon-thyme, palo santo in aroma and cup. Sweet structure with gently bright acidity; full, syrupy mouthfeel. The resonant, satisfying finish leads with notes of mango and ginger blossom with undertones of palo santo."
335,Paradise Roasters,Medium-Light,Hawai'I,22.0,"Richly and elegantly fruit-toned. Strawberry-guava, cocoa nib, violet, wild honey, aloe wood in aroma and cup. Vivaciously sweet-tart structure with juicy, balanced acidity; full, creamy mouthfeel. Resonant fruit-forward finish with notes of strawberry-guava, cocoa nib and violet."
487,Kakalove Cafe,Medium-Light,Taiwan,15.58,"Deep-toned, intricately balanced. Dried mulberry, dark chocolate, magnolia, sandalwood, pink peppercorn in aroma and small cup. Juicy-sweet structure with high-toned acidity; very full, syrupy mouthfeel. The resonant finish consolidates to notes of dried mulberry and pink peppercorn."
963,El Gran Cafe,Medium-Light,Guatemala,4.7,"Crisply sweet, nut-toned. Almond brittle, pie cherry, magnolia, baking chocolate, mesquite in aroma and cup. Sweet structure with brisk acidity; very syrupy mouthfeel. The finish consolidates to notes of baking chocolate, pie cherry and mesquite."
242,Kakalove Cafe,Medium-Light,Ethiopia,2.97,"Evaluated as espresso. Cleanly fruit-toned, deep, complex. Pomegranate, narcissus, lemon-thyme, chocolate fudge, sandalwood in aroma and small cup. Creamy mouthfeel; richly chocolaty finish with undertones of sandalwood. The milk shot is chocolaty through and through, fudge-like in its depth, complicated by sweet-tart pomegranate notes."
2,Simon Hsieh's Aroma Roast Coffees,Dark,Indonesia,8.5,"Evaluated as espresso. Very rich and deeply sweet. Dark chocolate, dried cherry, singed cedar, lilac, candy cap mushroom with layered complexity in aroma and small cup. Very thick, syrupy mouthfeel; the finish consolidates to smoky cocoa and sweetly savory mushroom. In three parts milk, the cup is very chocolaty, sweet and floral with an umami throughline. "
492,Dapper & Wise,Medium-Light,Ethiopia,5.88,"Crisply sweet-tart. Pineapple, baking chocolate, hazelnut, lily, fresh-cut fir in aroma and cup. Sweetly tart structure with pert acidity; crisp, satiny mouthfeel. The finish centers around notes of pineapple and lily with hints of hazelnut."
934,Kakalove Cafe,Medium-Light,Ethiopia,4.11,"High-toned, richly sweet-tart. Apricot, wild honey, sandalwood, roasted cacao nib, lilac in aroma and cup. Sweetly tart structure with vibrant, juicy acidity; plush, syrupy mouthfeel. The finish is resonant with all the aroma and flavor notes of the cup, leading with apricot and lilac in the short and cocoa-toned sandalwood in the long, all sustained by a deep, honeyish sweetness. "
635,Dragonfly Coffee Roasters,Medium-Light,Panama,44.09,"High-toned, balanced, deeply sweet. Pomelo, jasmine, cocoa nib, amber, agave syrup in aroma and cup. Brightly sweet structure with juicy acidity; syrupy-smooth mouthfeel. The crisply cocoa-toned finish is supported by pomelo and jasmine."
549,Jampot Poorock Abbey,Medium,Hawai'I,10.58,"Deep, sweet, gently roasty. Orange zest, scorched cedar, cocoa, roasted cashew, a hint of lily in aroma and cup. Roasty pungent but sweet in structure; plush and lightly syrupy in mouthfeel. Chocolaty, richly drying in the finish.  "
596,PT's Coffee Roasting Co.,Medium-Light,Panama,28.66,"Juicy, balanced, bright. Bing cherry, wisteria, cocoa nib, blood orange, marjoram in aroma and cup. Sweetly tart with citrusy acidity; plush, syrupy mouthfeel. The crisply sweet finish centers around notes of cherry and cocoa nib."
1052,Kakalove Cafe,Light,Ethiopia,5.31,"Complex, bright, cleanly fruit-forward. Meyer lemon zest, ripe plum, cocoa nib, violet, black sage in aroma and cup. Sweetly tart with crisp, juicy acidity; silky, supple mouthfeel. Deeply layered finish centered on stone fruit and cocoa."
954,Kakalove Cafe,Medium-Light,Ethiopia,4.11,"Lyrically sweet, intriguing tart, complexly savory. Mulberry, sage, bergamot, frankincense, apple blossom in aroma and cup. High-toned structure with delicately bright, multi-layered acidity; very viscous, plush mouthfeel. Resonant, flavor-laden finish, long and confident."
319,Corvus Coffee Roasters,Medium-Light,Ethiopia,5.58,"Deeply sweet, slightly fermenty. Dark chocolate, orange zest, whiskey barrel, almond butter, magnolia in aroma and cup. Bittersweet structure with round acidity; viscous, buoyant mouthfeel. Long, flavor-saturated, balanced finish."
234,Conscious Cup Coffee Roasters,Medium-Light,Guatemala,5.58,"Deeply chocolaty, vibrantly high-toned. Dark chocolate, nectarine, almond butter, freesia-like flowers, lemon thyme in aroma and cup. Sweet-tart structure with bright, juicy acidity; plush, syrupy-smooth mouthfeel. The resonantly chocolaty finish is supported by notes of almond butter and hints of freesia."
654,Omine Coffee,Light,Guatemala,16.0,"Juicy, fruit-driven, balanced. Raspberry jam, dark chocolate, narcissus, caramel, cedar in aroma and cup. Tart-leaning structure with winy acidity; impressively satiny-smooth mouthfeel. The crisply sweet-tart finish centers around raspberry and chocolate suggestions. "
165,Steady State Roasting Company,Medium-Light,Colombia,8.52,"Rich-toned, fruit-forward, sweetly tart. Pineapple, violet, cocoa nib, cedar, a hint of thyme in aroma and cup. Sweetly tart structure with vivid acidity; full, viscous mouthfeel.The fruit-toned finish leads with pineapple notes in the short, rounding to cocoa tones in the long."
